{
  "name": "example-requirement-verifier",
  "version": "0.1.0",
  "purpose": "Map a user requirement to observable verification evidence.",
  "triggers": ["complex build", "release review", "completion claim"],
  "inputs": [
    {"name": "requirement_ledger", "type": "json", "required": true, "description": "Explicit requirements and acceptance criteria."},
    {"name": "artifact", "type": "path-or-url", "required": true, "description": "The artifact or running result to inspect."}
  ],
  "outputs": [
    {"name": "evidence_report", "type": "json", "required": true, "description": "Verified, partial, unverified, deferred, and blocked items."}
  ],
  "procedure": ["Inspect the requirement ledger.", "Run the real artifact when available.", "Record evidence for each material criterion.", "Report gaps without claiming completion."],
  "constraints": ["Do not fabricate tests, tool results, or permissions.", "Do not modify the artifact without explicit scope."],
  "dependencies": ["requirement-traceability", "dynamic-verification", "completion-intelligence"],
  "composition": {"can_precede": ["repair-loop"], "can_follow": ["staged-execution"], "conflicts_with": [], "requires_sequential_state": false},
  "permissions": ["read:artifact", "execute:tests"],
  "risk_class": "low",
  "verification": ["Each must-have criterion has a cited observation or an explicit unverified status."],
  "evaluation": {"benchmark": "completion-and-verification-cases", "quality_threshold": 0.85, "held_out_required": true, "regression_cases": ["completion-001", "release-001"]},
  "lifecycle": "experimental",
  "provenance": ["Ai-skills architecture; example only"],
  "owner": "Ai-skills maintainers",
  "rollback": "Remove the contract from the registry and revert dependent routing changes.",
  "examples": [
    {"kind": "positive", "situation": "A must-have requirement has a live test result.", "response": "Mark it verified and cite the observation.", "why": "Completion is tied to external evidence."},
    {"kind": "negative", "situation": "The agent has only generated a plausible answer.", "response": "Mark the result unverified.", "why": "Output is not proof of completion."},
    {"kind": "borderline", "situation": "A screenshot appears polished but interaction behavior is unavailable.", "response": "Score visible qualities and mark live behavior not assessable.", "why": "A screenshot cannot establish keyboard, error, or recovery behavior."},
    {"kind": "exception", "situation": "The user explicitly requests a read-only review.", "response": "Do not modify the artifact while reviewing it.", "why": "The scope and permission are intentionally narrower."},
    {"kind": "transformation", "situation": "A completion claim has no evidence reference.", "response": "Convert it into a partial report with the missing evidence listed.", "why": "Honest incompleteness is safer than false success."}
  ],
  "limitations": ["Does not replace host-level permissions, sandboxing, or independent verification."],
  "uncertainty": ["Screenshot-only quality judgments cannot establish live interaction behavior."],
  "lessons_learned": ["Separate generated output from verified completion."],
  "version_history": [{"version": "0.1.0", "change": "Initial example contract", "evidence": "Repository validation and contract review"}]
}
